Unnamed: 0,headline,url,publisher,date,stock,Sentiment_DecisionTreeClassifier,Sentiment_finbert,Sentiment_LogisticRegression,Sentiment_KNeighborsClassifier,Sentiment_MultinomialNB,Sentiment_SGDClassifier,Sentiment_GradientBoostingClassifier,Sentiment_XGBClassifier,Sentiment_RandomForestClassifier,Sentiment_VADER
930498,cramer says the amd party is over calls out twitter trolls,https://www.benzinga.com/media/cnbc/17/10/10241614/cramer-says-the-amd-party-is-over-calls-out-twitter-trolls,Jayson Derrick,2017-10-27 00:00:00,NVDA,1,2,1,1,1,1,1,1,1,0.70095
930499,nvidia to report q earnings on thurs nov after market close,https://www.benzinga.com/news/earnings/17/10/10237569/nvidia-to-report-q3-earnings-on-thurs-nov-9-after-market-close,Paul Quintaro,2017-10-26 00:00:00,NVDA,1,2,1,1,1,1,1,1,1,0.5
930500,tech expert sean udall predicts no major earnings misses q rotation,https://www.benzinga.com/news/earnings/17/10/10233861/tech-expert-sean-udall-predicts-no-major-earnings-misses-q4-rotation,Elizabeth Balboa,2017-10-26 00:00:00,NVDA,1,2,1,1,0,1,1,1,1,0.26165
930501,nikkei asian review reports nvidia ceo huang sees fully driverless cars by but has no appetite for ai chips for mobile and connected devices,https://www.benzinga.com/news/17/10/10233885/nikkei-asian-review-reports-nvidia-ceo-huang-sees-fully-driverless-cars-by-2021-,Paul Quintaro,2017-10-26 00:00:00,NVDA,1,2,1,0,1,1,1,1,1,0.28925
930502,the market in minutes twitter beats estimates wsj goes after morningstars rating system,https://www.benzinga.com/news/17/10/10232339/the-market-in-5-minutes-twitter-beats-estimates-wsj-goes-after-morningstars-rati,Benzinga News Desk,2017-10-26 00:00:00,NVDA,1,2,1,1,1,1,1,1,1,0.5
930503,nvidia announces collaboration with taiwans ministry of science and technology to accelerate taiwan ai development,https://www.benzinga.com/news/17/10/10229927/nvidia-announces-collaboration-with-taiwans-ministry-of-science-and-technology-t,Charles Gross,2017-10-26 00:00:00,NVDA,1,0,1,0,1,1,1,1,1,0.5
930504,softbanks son aims to control of the chip market,https://www.benzinga.com/media/cnbc/17/10/10225647/softbanks-son-aims-to-control-90-of-the-chip-market,Paul Quintaro,2017-10-25 00:00:00,NVDA,1,2,1,1,1,1,1,1,1,0.5
930505,nvidia shares down over last few moments not seeing any news to justify price action,https://www.benzinga.com/movers/17/10/10225388/nvidia-shares-down-2-over-last-few-moments-not-seeing-any-news-to-justify-pric,Paul Quintaro,2017-10-25 00:00:00,NVDA,1,1,0,1,1,0,1,1,1,0.648
930506,stifel amds q wasnt as bad as it seems but not as good as hoped,https://www.benzinga.com/analyst-ratings/analyst-color/17/10/10223779/stifel-amds-q3-wasnt-as-bad-as-it-seems-but-not-as-good,Jayson Derrick,2017-10-25 00:00:00,NVDA,1,1,1,0,1,1,1,1,1,0.6497999999999999
930507,robotics ai fund thinks its found the new faang,https://www.benzinga.com/top-stories/17/10/10210954/robotics-ai-fund-thinks-its-found-the-new-faang,Elizabeth Balboa,2017-10-24 00:00:00,NVDA,1,2,1,1,1,1,1,1,1,0.5
930508,amd microchip tech among q semiconductor favorites at jefferies,https://www.benzinga.com/analyst-ratings/analyst-color/17/10/10212927/amd-microchip-tech-among-q3-semiconductor-favorites-at-,Shanthi Rexaline,2017-10-23 00:00:00,NVDA,1,2,1,1,0,1,1,1,1,0.71075
930509,why this analyst boosted his price target on franchise pick nvidia,https://www.benzinga.com/analyst-ratings/analyst-color/17/10/10211609/why-this-analyst-boosted-his-price-target-28-on-franchi,Elizabeth Balboa,2017-10-23 00:00:00,NVDA,1,2,1,1,1,1,1,1,1,0.6806
930510,this amd bear is no less bearish ahead of q earnings,https://www.benzinga.com/analyst-ratings/analyst-color/17/10/10211280/this-amd-bear-is-no-less-bearish-ahead-of-q3-earnings,Wayne Duggan,2017-10-23 00:00:00,NVDA,1,2,0,0,0,0,0,0,0,0.352
930511, biggest price target changes for monday,https://www.benzinga.com/analyst-ratings/price-target/17/10/10211136/5-biggest-price-target-changes-for-monday,Lisa Levin,2017-10-23 00:00:00,NVDA,1,2,0,0,0,0,1,0,1,0.5
930512,a benzinga hq exclusive ask gene munster anything,https://www.benzinga.com/trading-ideas/previews/17/10/10206267/a-benzinga-hq-exclusive-ask-gene-munster-anything,Elizabeth Balboa,2017-10-22 00:00:00,NVDA,1,2,1,1,1,1,1,1,1,0.5640000000000001
930513,fast money traders share their picks cisco nvidia and more,https://www.benzinga.com/media/cnbc/17/10/10207753/fast-money-traders-share-their-picks-cisco-nvidia-and-more,Craig Jones,2017-10-20 00:00:00,NVDA,1,2,1,1,0,1,1,1,1,0.648
930514,benzingas option alert recap from october ,https://www.benzinga.com/news/17/10/10202601/benzingas-option-alert-recap-from-october-19,Javier Hasse,2017-10-19 00:00:00,NVDA,1,2,1,1,1,1,1,1,1,0.648
930515,nvidia option alert oct calls sweep at the bid vs oi ref,https://www.benzinga.com/markets/options/17/10/10199633/nvidia-option-alert-oct-27-207-5-calls-sweep-48-at-the-bid-1274-0-443,Charles Gross,2017-10-19 00:00:00,NVDA,1,2,1,1,1,1,1,1,1,0.648
930516,benzingas option alert recap from october ,https://www.benzinga.com/news/17/10/10196539/benzingas-option-alert-recap-from-october-18,Javier Hasse,2017-10-18 00:00:00,NVDA,1,2,1,1,1,1,1,1,1,0.648
930517,sizing up semiconductor etfs for ,https://www.benzinga.com/analyst-ratings/analyst-color/17/10/10190380/sizing-up-semiconductor-etfs-for-2018,ETF Professor,2017-10-18 00:00:00,NVDA,1,2,1,1,1,1,1,1,1,0.5
930518,consumer reports withholds recommendation from microsofts surface book ,https://www.benzinga.com/news/17/10/10194138/consumer-reports-withholds-recommendation-from-microsofts-surface-book-2,Elizabeth Balboa,2017-10-18 00:00:00,NVDA,1,2,1,1,1,1,1,1,1,0.5
930519,nvidia option alert nov puts sweep at the ask vs oi ref,https://www.benzinga.com/markets/options/17/10/10193726/nvidia-option-alert-nov-3-177-5-puts-sweep-33-at-the-ask-759-0-73-vs-,Charles Gross,2017-10-18 00:00:00,NVDA,1,2,1,1,0,1,1,0,0,0.648
930520,nvidia seeing strong trends heading into next quarterly print,https://www.benzinga.com/analyst-ratings/analyst-color/17/10/10181728/nvidia-seeing-strong-trends-heading-into-next-quarterly,Jayson Derrick,2017-10-16 00:00:00,NVDA,1,0,1,0,1,1,1,1,1,0.7553000000000001
930521,nvidia shares make new week high ,https://www.benzinga.com/movers/17/10/10172897/nvidia-shares-make-new-52-week-high-192-96,Hal Lindon,2017-10-12 00:00:00,NVDA,1,0,1,1,1,1,1,1,1,0.648
930522,nvidia expands lead in aidriven vehicle suppliers with new products new partnerships,https://www.benzinga.com/analyst-ratings/analyst-color/17/10/10172758/nvidia-expands-lead-in-ai-driven-vehicle-suppliers-with,Elizabeth Balboa,2017-10-12 00:00:00,NVDA,1,0,1,1,1,1,1,1,1,0.55135
930523,rbc raises price target from to says they are confident in reacceleration in data center spending sees cont potential for eps upside driven by dc and gaming both nearterm and longterm,https://www.benzinga.com/analyst-ratings/analyst-color/17/10/10172860/rbc-raises-price-target-from-205-to-220-says-they-are-c,Paul Quintaro,2017-10-12 00:00:00,NVDA,1,0,1,1,1,1,1,1,1,0.74695
930524,an etf levered to the cryptocurrency trade,https://www.benzinga.com/trading-ideas/long-ideas/17/10/10169166/an-etf-levered-to-the-cryptocurrency-trade,ETF Professor,2017-10-12 00:00:00,NVDA,1,2,1,1,1,1,1,1,1,0.5
930525,the current bull and bear case for nvidia,https://www.benzinga.com/media/cnbc/17/10/10165309/the-current-bull-and-bear-case-for-nvidia,Jayson Derrick,2017-10-11 00:00:00,NVDA,1,2,1,0,0,0,1,1,1,0.5
930526,the market in minutes alibabas expansion ubers warning,https://www.benzinga.com/news/17/10/10165127/the-market-in-5-minutes-alibabas-expansion-ubers-warning,Benzinga News Desk,2017-10-11 00:00:00,NVDA,0,0,0,1,0,0,0,0,1,0.32999999999999996
930527,robotics analyst nvidias ai developments dont change the selfdriving car timeline,https://www.benzinga.com/analyst-ratings/analyst-color/17/10/10161945/robotics-analyst-nvidias-ai-developments-dont-change-th,Elizabeth Balboa,2017-10-10 00:00:00,NVDA,1,2,1,1,1,1,1,1,1,0.5
930528,loup ventures austin bohlig tells benzinga while nvidia has slight advantange in gpu space amd has made great progressmuch more competitive today,https://www.benzinga.com/analyst-ratings/analyst-color/17/10/10162176/loup-ventures-austin-bohlig-tells-benzinga-while-nvidia,Hal Lindon,2017-10-10 00:00:00,NVDA,1,0,1,1,1,1,1,1,1,0.8632
930529,loup ventures austin bohlig responds to nvidiadhl news tells benzinga similar announcements made with strategics will be catalysts for nvda amd shares in coming years,https://www.benzinga.com/analyst-ratings/analyst-color/17/10/10162168/loup-ventures-austin-bohlig-responds-to-nvidia-dhl-news,Hal Lindon,2017-10-10 00:00:00,NVDA,1,0,1,1,1,1,1,1,1,0.648
930530, semiconductor stocks fund managers are buying most,https://www.benzinga.com/analyst-ratings/analyst-color/17/10/10161491/4-semiconductor-stocks-fund-managers-are-buying-most,Elizabeth Balboa,2017-10-10 00:00:00,NVDA,1,2,1,0,1,1,1,1,1,0.5
930531,what ai and autonomous driving mean for nvidia investors,https://www.benzinga.com/news/17/10/10160824/what-ai-and-autonomous-driving-mean-for-nvidia-investors,Wayne Duggan,2017-10-10 00:00:00,NVDA,1,2,1,1,1,1,1,1,1,0.5
930532,the market in minutes nvidias drive russia and cryptos and carbon emission limits,https://www.benzinga.com/news/17/10/10158860/the-market-in-5-minutes-nvidias-drive-russia-and-cryptos-and-carbon-emission-lim,Benzinga News Desk,2017-10-10 00:00:00,NVDA,1,2,1,1,1,1,1,1,1,0.5
930533,american airlines cypress semi macys nvidia fast money picks for october ,https://www.benzinga.com/media/cnbc/17/10/10157219/american-airlines-cypress-semi-macys-nvidia-fast-money-picks-for-october-1,Craig Jones,2017-10-10 00:00:00,NVDA,1,2,0,1,0,0,1,1,1,0.5
930534,nvidia issues release highlighting deutsche post dhl group has selected cos drive px for autonomous delivery truck fleet,https://www.benzinga.com/news/17/10/10157759/nvidia-issues-release-highlighting-deutsche-post-dhl-group-has-selected-co-s-dri,Paul Quintaro,2017-10-10 00:00:00,NVDA,1,0,1,1,1,1,1,1,1,0.5
930535,nvidia unveils worlds first ai computer aimed at making robotaxis a reality,https://www.benzinga.com/news/17/10/10157732/nvidia-unveils-worlds-first-ai-computer-aimed-at-making-robotaxis-a-reality,Paul Quintaro,2017-10-10 00:00:00,NVDA,1,2,1,1,1,1,1,1,1,0.5
930536,report amd navi gpu could arrive by next year,https://www.benzinga.com/news/17/10/10156633/report-amd-navi-gpu-could-arrive-by-next-year,Shanthi Rexaline,2017-10-09 00:00:00,NVDA,1,2,1,1,0,1,1,1,1,0.5
930537,analysts more positive on nvidia amd following processor conference,https://www.benzinga.com/analyst-ratings/analyst-color/17/10/10156342/analysts-more-positive-on-nvidia-amd-following-processo,Craig Jones,2017-10-09 00:00:00,NVDA,1,0,1,0,1,1,1,1,1,0.7992
930538,are options traders betting on a big move in nvidia,https://www.benzinga.com/markets/options/17/10/10155419/are-options-traders-betting-on-a-big-move-in-nvidia,Zacks,2017-10-09 00:00:00,NVDA,1,2,1,1,1,1,1,1,1,0.5
930539,benzingas option alert recap from october ,https://www.benzinga.com/news/17/10/10147933/benzingas-option-alert-recap-from-october-5,Javier Hasse,2017-10-05 00:00:00,NVDA,1,2,1,1,1,1,1,1,1,0.648
930540,tech stock roundup msft nvda tsla intc and more,https://www.benzinga.com/news/17/10/10142481/tech-stock-roundup-msft-nvda-tsla-intc-and-more,Zacks,2017-10-05 00:00:00,NVDA,1,2,0,0,0,0,1,1,1,0.5
930541, upside seen for nvidia shares on pc gaming bitcoin mining strength,https://www.benzinga.com/analyst-ratings/analyst-color/17/10/10145628/14-upside-seen-for-nvidia-shares-on-pc-gaming-bitcoin-m,Elizabeth Balboa,2017-10-05 00:00:00,NVDA,1,0,1,1,1,1,1,1,1,0.82985
930542,nvidia option alert jun puts at the bid vs oi ref,https://www.benzinga.com/markets/options/17/10/10145890/nvidia-option-alert-jun-15-180-puts-at-the-bid-900-22-851-vs-882-oi-r,Charles Gross,2017-10-05 00:00:00,NVDA,1,2,1,0,0,0,1,0,0,0.648
930543,expect nvidia amd to ride cryptocurrency wave into ,https://www.benzinga.com/analyst-ratings/analyst-color/17/10/10141359/expect-nvidia-amd-to-ride-cryptocurrency-wave-into-2018,Shanthi Rexaline,2017-10-05 00:00:00,NVDA,1,0,1,1,1,1,1,1,1,0.5
930544,amd nvidia among bank of americas top picks in a q strong for semis,https://www.benzinga.com/analyst-ratings/analyst-color/17/10/10133463/amd-nvidia-among-bank-of-americas-9-top-picks-in-a-q3-s,Taylor Cox,2017-10-03 00:00:00,NVDA,1,0,1,0,1,1,1,1,1,0.81245
930545, biggest price target changes for monday,https://www.benzinga.com/analyst-ratings/price-target/17/10/10125320/5-biggest-price-target-changes-for-monday,Lisa Levin,2017-10-02 00:00:00,NVDA,1,2,0,0,0,0,1,0,1,0.5
930546,tech tempts but valuations look high,https://www.benzinga.com/trading-ideas/long-ideas/17/10/10123238/tech-tempts-but-valuations-look-high,ETF Professor,2017-10-02 00:00:00,NVDA,1,0,1,0,1,1,1,1,1,0.5
930547, biggest price target changes for friday,https://www.benzinga.com/analyst-ratings/price-target/17/09/10121312/5-biggest-price-target-changes-for-friday,Lisa Levin,2017-09-29 00:00:00,NVDA,1,2,1,1,1,1,1,1,1,0.5
930548,amd vs cypress vs cavium which semi has biggest potential upside,https://www.benzinga.com/analyst-ratings/analyst-color/17/09/10114571/amd-vs-cypress-vs-cavium-which-semi-has-biggest-potenti,Shanthi Rexaline,2017-09-28 00:00:00,NVDA,1,0,1,1,0,1,1,1,1,0.5
930549,ai summit in san francisco concludes today attendees include morgan stanley johnson johnson bank of america ibm nvidia microsoft amazon and footlocker,https://www.benzinga.com/news/17/09/10113098/a-i-summit-in-san-francisco-concludes-today-attendees-include-morgan-stanley-joh,Hal Lindon,2017-09-28 00:00:00,NVDA,1,2,1,0,1,1,1,1,1,0.58895
930550,morgan stanley calls for upside in ambarella,https://www.benzinga.com/analyst-ratings/analyst-color/17/09/10106939/morgan-stanley-calls-for-150-upside-in-ambarella,Shanthi Rexaline,2017-09-27 00:00:00,NVDA,1,0,1,1,1,1,1,1,1,0.5
930551,tesla spokesperson tells benzinga teslas policy is to always decline to comment on speculation following report co shifting from nvidia to intel for infotainment needs,https://www.benzinga.com/news/17/09/10104963/tesla-spokesperson-tells-benzinga-teslas-policy-is-to-always-decline-to-comment-,Paul Quintaro,2017-09-26 00:00:00,NVDA,1,2,1,1,0,1,1,1,0,0.5
930552,intel shares spiking higher amid report tesla is shifting from nvidia to intel related to infotainment,https://www.benzinga.com/news/17/09/10104013/intel-shares-spiking-higher-amid-report-tesla-is-shifting-from-nvidia-to-intel-r,Paul Quintaro,2017-09-26 00:00:00,NVDA,1,0,1,1,1,1,1,1,1,0.648
930553,chinese oems will use nvidias hgx reference architecture for data centers,https://www.benzinga.com/trading-ideas/long-ideas/17/09/10101330/chinese-oems-will-use-nvidias-hgx-reference-architecture-for,Elizabeth Balboa,2017-09-26 00:00:00,NVDA,1,2,1,1,1,1,1,1,1,0.5
930554,nvidia shares higher following announcement that chinese oems will use nvidia hgx reference architecture for data centers,https://www.benzinga.com/news/17/09/10100572/nvidia-shares-higher-following-announcement-that-chinese-oems-will-use-nvidia-hg,Paul Quintaro,2017-09-26 00:00:00,NVDA,1,0,1,1,1,1,1,1,1,0.648
930555,when bull markets die what to watch for what stocks could be the first to get hit,https://www.benzinga.com/general/education/17/09/10091774/when-bull-markets-die-what-to-watch-for-what-stocks-could-be-the-fi,Shanthi Rexaline,2017-09-25 00:00:00,NVDA,1,2,1,1,1,0,1,1,1,0.20029999999999998
930556,nibbling at a semiconductor etf,https://www.benzinga.com/trading-ideas/long-ideas/17/09/10093327/nibbling-at-a-semiconductor-etf,ETF Professor,2017-09-25 00:00:00,NVDA,1,2,1,0,1,1,1,1,1,0.5
930557,amd sells off as tesla rumor cools down analyst calls partnership completely false,https://www.benzinga.com/analyst-ratings/analyst-color/17/09/10089880/amd-sells-off-as-tesla-rumor-cools-down-analyst-calls-p,Wayne Duggan,2017-09-22 00:00:00,NVDA,1,1,1,0,1,1,1,1,1,0.5
930558,midday market update calgon carbon gains on acquisition news jakks pacific shares drop,https://www.benzinga.com/news/17/09/10086618/mid-day-market-update-calgon-carbon-drops-on-acquisition-news-jakks-pacific-shar,Lisa Levin,2017-09-21 00:00:00,NVDA,1,1,0,1,1,0,0,0,0,0.6806
930559,teslaamd partnership likely a modest negative for nvidia but its competitive moat still substantial,https://www.benzinga.com/analyst-ratings/analyst-color/17/09/10086137/tesla-amd-partnership-likely-a-modest-negative-for-nvid,Wayne Duggan,2017-09-21 00:00:00,NVDA,1,0,0,1,1,0,1,0,1,0.61315
930560,what a possible amdtesla deal means for nvidia,https://www.benzinga.com/analyst-ratings/analyst-color/17/09/10085379/what-a-possible-amd-tesla-deal-means-for-nvidia,Wayne Duggan,2017-09-21 00:00:00,NVDA,1,2,1,1,1,1,1,1,1,0.5
930561,rbc analyst comments on implications for nvidia from possible amdtesla deal deal will unlikely result in a single source dynamic where tesla only works with amd,https://www.benzinga.com/analyst-ratings/analyst-color/17/09/10085005/rbc-analyst-comments-on-implications-for-nvidia-from-po,Paul Quintaro,2017-09-21 00:00:00,NVDA,1,2,1,1,1,1,1,0,0,0.6909
930562,amd might be working with tesla on an ai chip,https://www.benzinga.com/media/cnbc/17/09/10082927/amd-might-be-working-with-tesla-on-an-ai-chip,Elizabeth Balboa,2017-09-20 00:00:00,NVDA,1,2,1,1,0,1,1,1,1,0.5
930563,benzingas option alert recap from september ,https://www.benzinga.com/news/17/09/10082821/benzingas-option-alert-recap-from-september-20,Javier Hasse,2017-09-20 00:00:00,NVDA,1,2,1,1,1,0,1,1,1,0.648
930564,nvidia shares respond lower down over last min following cnbc report tesla working with amd for developing of its own ai chip for selfdriving cars,https://www.benzinga.com/movers/17/09/10082571/nvidia-shares-respond-lower-down-1-20-over-last-min-following-cnbc-report-tesl,Paul Quintaro,2017-09-20 00:00:00,NVDA,0,1,0,1,0,0,0,0,0,0.5
930565,nvidia option alert sep puts sweep at the ask vs oi ref,https://www.benzinga.com/markets/options/17/09/10081495/nvidia-option-alert-sep-29-182-5-puts-sweep-25-at-the-ask-549-2-07-vs,Charles Gross,2017-09-20 00:00:00,NVDA,1,2,0,1,0,0,1,0,0,0.648
930566,analyst teslas selfdriving technology is exaggerated,https://www.benzinga.com/analyst-ratings/analyst-color/17/09/10080561/analyst-teslas-self-driving-technology-is-exaggerated,Wayne Duggan,2017-09-20 00:00:00,NVDA,1,2,1,0,1,1,1,1,1,0.44865
930567,amd marvell gain semiconductor share in q,https://www.benzinga.com/analyst-ratings/analyst-color/17/09/10075390/amd-marvell-gain-semiconductor-share-in-q3,Wayne Duggan,2017-09-19 00:00:00,NVDA,1,0,1,1,1,1,1,1,1,0.8404
930568,fast money traders share their picks in the chip space,https://www.benzinga.com/analyst-ratings/analyst-color/17/09/10072216/fast-money-traders-share-their-picks-in-the-chip-space,Craig Jones,2017-09-19 00:00:00,NVDA,1,2,1,1,1,1,1,1,1,0.648
930569,vetr crowd downgrades nvidia,https://www.benzinga.com/analyst-ratings/downgrades/17/09/10071487/vetr-crowd-downgrades-nvidia,Spencer White,2017-09-18 00:00:00,NVDA,1,2,1,1,0,1,1,1,1,0.5
930570,benzingas option alert recap from september ,https://www.benzinga.com/news/17/09/10070958/benzingas-option-alert-recap-from-september-18,Javier Hasse,2017-09-18 00:00:00,NVDA,1,2,1,1,1,0,1,1,1,0.648
930571,any nice chart needs a catalyst nvidia has one,https://www.benzinga.com/news/17/09/10070182/any-nice-chart-needs-a-catalyst-nvidia-has-one,Shanthi Rexaline,2017-09-18 00:00:00,NVDA,1,2,1,1,1,1,1,1,1,0.71075
930572,nvidia option alert mar calls at the ask vs oi ref,https://www.benzinga.com/markets/options/17/09/10069837/nvidia-option-alert-mar-16-240-calls-at-the-ask-500-7-1-vs-274-oi-ref,Charles Gross,2017-09-18 00:00:00,NVDA,1,2,1,1,1,1,1,1,1,0.648
930573,citrons andrew left on cnbc says hes not currently short nvidia,https://www.benzinga.com/analyst-ratings/analyst-color/17/09/10069800/citrons-andrew-left-on-cnbc-says-hes-not-currently-shor,Paul Quintaro,2017-09-18 00:00:00,NVDA,0,2,0,0,0,0,0,0,0,0.5
930574,nvidia option alert jan puts above ask vs oi ref,https://www.benzinga.com/markets/options/17/09/10068978/nvidia-option-alert-jan-19-185-puts-above-ask-500-15-901-vs-101-oi-re,Charles Gross,2017-09-18 00:00:00,NVDA,1,0,0,1,0,0,1,0,0,0.648
930575,all the reasons bank of america just bumped its nvidia price target to ,https://www.benzinga.com/analyst-ratings/analyst-color/17/09/10068713/all-the-reasons-bank-of-america-just-bumped-its-nvidia-,Jayson Derrick,2017-09-18 00:00:00,NVDA,1,2,1,1,1,1,1,1,1,0.5
930576, biggest price target changes for monday,https://www.benzinga.com/analyst-ratings/price-target/17/09/10068544/5-biggest-price-target-changes-for-monday,Lisa Levin,2017-09-18 00:00:00,NVDA,1,2,0,0,0,0,1,0,1,0.5
930577,watch these huge put purchases in monday trade,https://www.benzinga.com/markets/options/17/09/10066881/watch-these-4-huge-put-purchases-in-monday-trade,Lisa Levin,2017-09-18 00:00:00,NVDA,1,2,1,1,0,0,1,1,1,0.6591
930578,all the nvidia launches thus far this year,https://www.benzinga.com/general/education/17/09/10061379/all-the-nvidia-launches-thus-far-this-year,Shanthi Rexaline,2017-09-15 00:00:00,NVDA,1,2,1,1,1,1,1,1,1,0.5
930579,benzingas option alert recap from september ,https://www.benzinga.com/news/17/09/10064848/benzingas-option-alert-recap-from-september-15,Javier Hasse,2017-09-15 00:00:00,NVDA,1,2,1,1,1,0,1,1,1,0.648
930580,midafternoon market update dow rises over points t biosystems shares plummet,https://www.benzinga.com/news/17/09/10064470/mid-afternoon-market-update-dow-rises-over-50-points-t2-biosystems-shares-plumme,Lisa Levin,2017-09-15 00:00:00,NVDA,1,1,1,1,1,0,1,0,1,0.648
930581,midday market update mirati therapeutics climbs following positive sitravatinib data first internet bancorp shares slide,https://www.benzinga.com/news/17/09/10063805/mid-day-market-update-mirati-therapeutics-climbs-following-positive-sitravatinib,Lisa Levin,2017-09-15 00:00:00,NVDA,1,0,1,1,1,1,1,1,1,0.85015
930582,nvidia option alert sep puts at the bid vs oi ref,https://www.benzinga.com/markets/options/17/09/10063784/nvidia-option-alert-sep-29-172-5-puts-at-the-bid-600-2-0-vs-48-oi-ref,Charles Gross,2017-09-15 00:00:00,NVDA,1,2,0,0,0,0,1,0,0,0.648
930583, biggest price target changes for friday,https://www.benzinga.com/analyst-ratings/price-target/17/09/10062848/5-biggest-price-target-changes-for-friday,Lisa Levin,2017-09-15 00:00:00,NVDA,1,2,1,1,1,1,1,1,1,0.5
930584,nvidia is building the industry standard for ai analyst lifts price target to ,https://www.benzinga.com/analyst-ratings/analyst-color/17/09/10062282/nvidia-is-building-the-industry-standard-for-ai-analyst,Jayson Derrick,2017-09-15 00:00:00,NVDA,1,0,1,1,1,1,1,1,1,0.5
930585,watch these huge call purchases in thursday trade,https://www.benzinga.com/markets/options/17/09/10055716/watch-these-8-huge-call-purchases-in-thursday-trade,Lisa Levin,2017-09-14 00:00:00,NVDA,1,2,1,0,1,0,1,1,1,0.6591
930586,benzingas option alert recap from september ,https://www.benzinga.com/news/17/09/10053832/benzingas-option-alert-recap-from-september-13,Javier Hasse,2017-09-13 00:00:00,NVDA,1,2,1,1,1,0,1,1,1,0.648
930587,nvidia option alert mar calls at the ask vs oi ref,https://www.benzinga.com/markets/options/17/09/10052505/nvidia-option-alert-mar-16-130-calls-at-the-ask-10000-45-951-vs-8-oi-,Charles Gross,2017-09-13 00:00:00,NVDA,1,2,1,1,1,1,1,1,1,0.648
930588,all the stocks that moved during apples product unveil event,https://www.benzinga.com/news/17/09/10051777/all-the-stocks-that-moved-during-apples-product-unveil-event,Elizabeth Balboa,2017-09-13 00:00:00,NVDA,1,2,1,0,1,1,1,1,1,0.5
930589,intel nvidia amd shares unaffected following news out of apple product unveil event the new iphone will have for the first time an appledesigned graphic processing unit,https://www.benzinga.com/news/17/09/10047109/intel-nvidia-amd-shares-unaffected-following-news-out-of-apple-product-unveil-ev,Paul Quintaro,2017-09-12 00:00:00,NVDA,1,1,1,1,1,1,1,1,1,0.648
930590,amd and nvidia how vulnerable are they to cryptocurrency concerns,https://www.benzinga.com/analyst-ratings/analyst-color/17/09/10039705/amd-and-nvidia-how-vulnerable-are-they-to-cryptocurrenc,Wayne Duggan,2017-09-11 00:00:00,NVDA,1,2,1,0,0,0,1,1,1,0.38685
930591,heres what investors were buying and selling in august,https://www.benzinga.com/news/earnings/17/09/10017382/heres-what-investors-were-buying-and-selling-in-august,Chris Dier-Scalise,2017-09-06 00:00:00,NVDA,1,2,1,1,1,1,1,1,1,0.5
930592,nvidia leader in ai chip market digitimes,https://www.benzinga.com/news/17/09/10018680/nvidia-leader-in-ai-chip-market-digitimes,Charles Gross,2017-09-06 00:00:00,NVDA,1,2,1,1,1,1,1,1,1,0.5
930593,benzingas option alert recap from august ,https://www.benzinga.com/news/17/08/10004424/benzingas-option-alert-recap-from-august-31,Javier Hasse,2017-08-31 00:00:00,NVDA,1,2,1,1,1,1,1,1,1,0.648
930594,steel is for real,https://www.benzinga.com/trading-ideas/long-ideas/17/08/9996517/steel-is-for-real,Tatro Capital,2017-08-31 00:00:00,NVDA,1,2,1,1,1,0,1,1,1,0.5
930595,nvidia option alert nov puts at the ask vs oi ref,https://www.benzinga.com/markets/options/17/08/10002084/nvidia-option-alert-nov-17-145-puts-at-the-ask-1200-3-65-vs-1188-oi-r,Charles Gross,2017-08-31 00:00:00,NVDA,1,2,1,1,0,1,1,0,0,0.648
930596,theres a late summer souring on semiconductor etfs,https://www.benzinga.com/trading-ideas/long-ideas/17/08/9993555/theres-a-late-summer-souring-on-semiconductor-etfs,ETF Professor,2017-08-30 00:00:00,NVDA,1,1,1,1,1,1,1,1,1,0.5
930597,nvidia shares quiet as global equities trip chowdhry says they see walmart going full steam with deep neural networks and will be creating its own nvda gpu clusters on walmart cloud oneops,https://www.benzinga.com/analyst-ratings/analyst-color/17/08/9991063/nvidia-shares-quiet-as-global-equities-trip-chowdhry-say,Paul Quintaro,2017-08-29 00:00:00,NVDA,1,0,1,1,1,1,1,1,1,0.76335
