Unnamed: 0,headline,url,publisher,date,stock,Sentiment_DecisionTreeClassifier,Sentiment_finbert,Sentiment_LogisticRegression,Sentiment_KNeighborsClassifier,Sentiment_MultinomialNB,Sentiment_SGDClassifier,Sentiment_GradientBoostingClassifier,Sentiment_XGBClassifier,Sentiment_RandomForestClassifier,Sentiment_VADER
929039,shares of several technology companies are trading higher on continued volatility despite market weakness the sector sold off recently as other sectors gained amid us economic reopening and appears to be rebounding,https://www.benzinga.com/wiim/20/06/16224173/shares-of-several-technology-companies-are-trading-higher-on-continued-volatility-despite-market-wea,Benzinga窶クewsdesk,2020-06-10 12:37:10-04:00,NVDA,1,0,1,1,1,1,1,1,1,0.8648
929040,afternoon market stats in minutes,https://www.benzinga.com/markets/20/06/16223572/afternoon-market-stats-in-5-minutes,Benzinga Insights,2020-06-10 12:12:25-04:00,NVDA,1,2,1,1,0,0,1,1,1,0.5
929041,morning market stats in minutes,https://www.benzinga.com/markets/20/06/16221744/morning-market-stats-in-5-minutes,Benzinga Insights,2020-06-10 10:22:11-04:00,NVDA,1,2,1,1,1,1,1,1,1,0.5
929042,shares of several technology companies are trading higher despite market weakness the sector recently experienced some welling and appears to be rebounding following dip,https://www.benzinga.com/wiim/20/06/16214789/shares-of-several-technology-companies-are-trading-higher-despite-market-weakness-the-sector-recentl,Benzinga窶クewsdesk,2020-06-09 13:40:43-04:00,NVDA,1,0,1,1,1,1,1,1,1,0.8648
929043,afternoon market stats in minutes,https://www.benzinga.com/markets/20/06/16203190/afternoon-market-stats-in-5-minutes,Benzinga Insights,2020-06-08 12:30:29-04:00,NVDA,1,2,1,1,0,0,1,1,1,0.5
929044,shares of some technology companies are trading lower despite market strength the sector has performed well this year to date and appears to be giving back some gains following run up,https://www.benzinga.com/wiim/20/06/16202647/shares-of-some-technology-companies-are-trading-lower-despite-market-strength-the-sector-has-perform,Benzinga窶クewsdesk,2020-06-08 10:53:46-04:00,NVDA,0,1,1,1,1,1,0,0,0,0.753
929045,morning market stats in minutes,https://www.benzinga.com/intraday-update/20/06/16201614/morning-market-stats-in-5-minutes,Benzinga Insights,2020-06-08 09:47:06-04:00,NVDA,1,2,1,1,1,1,1,1,1,0.5
929046,why bofa recommends buying gpu plays amd and nvidia,https://www.benzinga.com/analyst-ratings/analyst-color/20/06/16159710/why-bofa-recommends-buying-gpu-plays-amd-and-nvidia,Shanthi Rexaline,2020-06-02 13:20:06-04:00,NVDA,1,2,1,1,0,1,1,1,1,0.7202
929047,cramer weighs in on ciena harleydavidson and more,https://www.benzinga.com/media/20/06/16156600/cramer-weighs-in-on-ciena-harley-davidson-and-more,Craig Jones,2020-06-02 07:14:40-04:00,NVDA,1,1,1,1,1,1,1,1,1,0.5
929048,semiconductor industry to lobby for billions to boost us manufacturing,https://www.benzinga.com/news/20/05/16146018/semiconductor-industry-to-lobby-for-billions-to-boost-u-s-manufacturing,Charles Gross,2020-05-31 11:05:12-04:00,NVDA,1,0,1,0,1,0,1,1,1,0.71075
929049,synopsys siliconproven designware ddr ip for highperformance cloud computing networking chips selected by nvidia,https://www.benzinga.com/news/20/05/16127281/synopsys-silicon-proven-designware-ddr-ip-for-high-performance-cloud-computing-networking-chips-sele,Benzinga Newsdesk,2020-05-28 00:00:00,NVDA,1,2,1,1,1,1,1,1,1,0.5
929050,chip stocks move higher following strong guidance out of memory manufacturer micron intel shares up amd down nvidia down ,https://www.benzinga.com/news/20/05/16120537/chip-stocks-move-higher-following-strong-guidance-out-of-memory-manufacturer-micron-intel-shares-up,Benzinga Newsdesk,2020-05-27 00:00:00,NVDA,1,0,1,1,1,1,1,1,1,0.83525
929051,shares of several companies in the broader technology sector are trading lower despite market strength weakness potentially related to business reopenings and eased lockdown restrictions as several names in the tech sector have benefited from workfromhome home entertainment and ecommerce trends amid the pandemic,https://www.benzinga.com/wiim/20/05/16116988/shares-of-several-companies-in-the-broader-technology-sector-are-trading-lower-despite-market-streng,Benzinga窶クewsdesk,2020-05-27 00:00:00,NVDA,0,1,1,1,1,0,0,1,0,0.78625
929052,stocks that hit week highs on tuesday,https://www.benzinga.com/news/20/05/16106805/stocks-that-hit-52-week-highs-on-tuesday,Benzinga Insights,2020-05-26 00:00:00,NVDA,1,2,0,0,1,1,1,1,1,0.5
929053, nonsemiconductor etfs benefiting from nvidia exposure,https://www.benzinga.com/trading-ideas/long-ideas/20/05/16102903/3-non-semiconductor-etfs-benefiting-from-nvidia-exposure,ETF Professor,2020-05-26 00:00:00,NVDA,1,0,1,1,1,1,1,1,1,0.5
929054,nvidia shares are trading higher after morgan stanley maintained its overweight rating on the stock and raised its price target from to per share,https://www.benzinga.com/wiim/20/05/16105092/nvidia-shares-are-trading-higher-after-morgan-stanley-maintained-its-overweight-rating-on-the-stock,Benzinga Newsdesk,2020-05-26 00:00:00,NVDA,1,0,1,1,1,1,1,1,1,0.61315
929055,morgan stanley maintains overweight on nvidia raises price target to ,https://www.benzinga.com/news/20/05/16104849/morgan-stanley-maintains-overweight-on-nvidia-raises-price-target-to-363,vishwanath@benzinga.com,2020-05-26 00:00:00,NVDA,1,1,1,1,1,1,1,1,1,0.3194
929056,bulls and bears of the week carvana comcast walmart and more,https://www.benzinga.com/trading-ideas/long-ideas/20/05/16100390/bulls-and-bears-of-the-week-carvana-comcast-walmart-and-more,Nelson Hem,2020-05-23 00:00:00,NVDA,1,2,1,1,1,1,1,1,1,0.5
929057, nvidia analysts on q beat ampere gpu a pure play in accelerated computing,https://www.benzinga.com/analyst-ratings/analyst-color/20/05/16094454/9-nvidia-analysts-on-q1-beat-ampere-gpu-a-pure-play-in-accelerated-computing,Shanthi Rexaline,2020-05-22 00:00:00,NVDA,1,0,1,0,1,0,1,1,1,0.67
929058,moderna nvidia deere form bright spots amid worries over uschina relationship,https://www.benzinga.com/news/earnings/20/05/16094537/moderna-nvidia-deere-form-bright-spots-amid-worries-over-u-s-china-relationship,JJ Kinahan,2020-05-22 00:00:00,NVDA,1,0,1,1,1,1,1,1,0,0.5129
929059,cascend maintains buy on nvidia raises price target to ,https://www.benzinga.com/news/20/05/16094529/cascend-maintains-buy-on-nvidia-raises-price-target-to-380,Benzinga_Newsdesk,2020-05-22 00:00:00,NVDA,1,0,1,1,1,1,1,1,1,0.5
929060,piper sandler maintains overweight on nvidia raises price target to ,https://www.benzinga.com/news/20/05/16094328/piper-sandler-maintains-overweight-on-nvidia-raises-price-target-to-390,Vick Meyer,2020-05-22 00:00:00,NVDA,1,1,1,1,1,1,1,1,1,0.3194
929061,ubs maintains buy on nvidia raises price target to ,https://www.benzinga.com/news/20/05/16094106/ubs-maintains-buy-on-nvidia-raises-price-target-to-400,vishwanath@benzinga.com,2020-05-22 00:00:00,NVDA,1,0,1,1,1,1,1,1,1,0.5
929062,nvidia shares are trading higher after the company reported betterthanexpected q eps and sales results,https://www.benzinga.com/wiim/20/05/16094016/nvidia-shares-are-trading-higher-after-the-company-reported-better-than-expected-q1-eps-and-sales-re,Benzinga Newsdesk,2020-05-22 00:00:00,NVDA,1,0,1,1,1,1,1,1,1,0.648
929063,b of a securities reiterates buy on nvidia raises price target to ,https://www.benzinga.com/news/20/05/16093934/b-of-a-securities-reiterates-buy-on-nvidia-raises-price-target-to-420,Benzinga_Newsdesk,2020-05-22 00:00:00,NVDA,1,2,1,1,1,1,1,1,1,0.648
929064,deutsche bank maintains hold on nvidia raises price target to ,https://www.benzinga.com/news/20/05/16093815/deutsche-bank-maintains-hold-on-nvidia-raises-price-target-to-315,Vick Meyer,2020-05-22 00:00:00,NVDA,1,2,0,1,0,0,1,1,1,0.5
929065,raymond james reiterates outperform on nvidia raises price target to ,https://www.benzinga.com/news/20/05/16093503/raymond-james-reiterates-outperform-on-nvidia-raises-price-target-to-370,Benzinga_Newsdesk,2020-05-22 00:00:00,NVDA,1,1,1,1,1,1,1,1,1,0.5
929066,oppenheimer maintains outperform on nvidia raises price target to ,https://www.benzinga.com/news/20/05/16093473/oppenheimer-maintains-outperform-on-nvidia-raises-price-target-to-400,Vick Meyer,2020-05-22 00:00:00,NVDA,1,1,1,1,1,1,1,1,1,0.5
929067, biggest price target changes for friday,https://www.benzinga.com/analyst-ratings/price-target/20/05/16093262/10-biggest-price-target-changes-for-friday,Lisa Levin,2020-05-22 00:00:00,NVDA,1,2,1,1,1,1,1,1,1,0.5
929068,wedbush maintains outperform on nvidia raises price target to ,https://www.benzinga.com/news/20/05/16093255/wedbush-maintains-outperform-on-nvidia-raises-price-target-to-420,Vick Meyer,2020-05-22 00:00:00,NVDA,1,0,1,1,1,1,1,1,1,0.5
929069,mizuho reiterates buy on nvidia raises price target to ,https://www.benzinga.com/news/20/05/16093179/mizuho-reiterates-buy-on-nvidia-raises-price-target-to-400,Benzinga_Newsdesk,2020-05-22 00:00:00,NVDA,1,0,1,1,1,1,1,1,1,0.5
929070,wells fargo maintains overweight on nvidia raises price target to ,https://www.benzinga.com/news/20/05/16093178/wells-fargo-maintains-overweight-on-nvidia-raises-price-target-to-430,Vick Meyer,2020-05-22 00:00:00,NVDA,1,2,1,1,1,1,1,1,1,0.436
929071,nomura instinet maintains reduce on nvidia raises price target to ,https://www.benzinga.com/news/20/05/16093086/nomura-instinet-maintains-reduce-on-nvidia-raises-price-target-to-260,Vick Meyer,2020-05-22 00:00:00,NVDA,1,0,0,1,0,0,1,1,1,0.5
929072,suntrust robinson humphrey maintains buy on nvidia raises price target to ,https://www.benzinga.com/news/20/05/16093034/suntrust-robinson-humphrey-maintains-buy-on-nvidia-raises-price-target-to-384,Vick Meyer,2020-05-22 00:00:00,NVDA,1,0,1,1,1,1,1,1,1,0.5
929073,rosenblatt maintains buy on nvidia raises price target to ,https://www.benzinga.com/news/20/05/16092691/rosenblatt-maintains-buy-on-nvidia-raises-price-target-to-400,Benzinga_Newsdesk,2020-05-22 00:00:00,NVDA,1,0,1,1,1,1,1,1,1,0.5
929074,needham maintains buy on nvidia raises price target to ,https://www.benzinga.com/news/20/05/16092618/needham-maintains-buy-on-nvidia-raises-price-target-to-400,vishwanath@benzinga.com,2020-05-22 00:00:00,NVDA,1,0,1,1,1,1,1,1,1,0.5
929075,a peek into the markets us stock futures down ahead of threeday weekend,https://www.benzinga.com/news/earnings/20/05/16092377/a-peek-into-the-markets-us-stock-futures-down-ahead-of-three-day-weekend,Lisa Levin,2020-05-22 00:00:00,NVDA,1,1,1,1,1,1,1,1,1,0.5
929076, stocks to watch for may ,https://www.benzinga.com/news/earnings/20/05/16092223/7-stocks-to-watch-for-may-22-2020,Lisa Levin,2020-05-22 00:00:00,NVDA,1,2,1,1,1,0,1,1,1,0.5
929077,nvidia reports q earnings beat,https://www.benzinga.com/news/earnings/20/05/16089310/nvidia-reports-q1-earnings-beat,Tanzeel Akhtar,2020-05-21 00:00:00,NVDA,1,2,1,0,1,1,1,1,1,0.5
929078,nvidia sees q sales b vs b estimate gross margins ,https://www.benzinga.com/news/20/05/16089229/nvidia-sees-q2-sales-3-65b-2-vs-3-15b-estimate-gross-margins-58-6-66,Benzinga Newsdesk,2020-05-21 00:00:00,NVDA,1,2,1,1,0,1,1,1,1,0.26165
929079,nvidia q adj eps beats estimate sales b beat b estimate,https://www.benzinga.com/news/earnings/20/05/16089216/nvidia-q1-adj-eps-1-800-beats-1-680-estimate-sales-3-080b-beat-2-980b-estimate,Benzinga Newsdesk,2020-05-21 00:00:00,NVDA,1,2,0,0,0,0,1,1,1,0.5
929080,heres how long it took nvidia to reach a b market cap,https://www.benzinga.com/general/education/20/05/16067606/heres-how-long-it-took-nvidia-to-reach-a-100b-market-cap,Shanthi Rexaline,2020-05-21 00:00:00,NVDA,1,2,1,1,1,1,1,1,1,0.5129
929081,climate change up and down pattern continues as week advances and powell awaited,https://www.benzinga.com/news/earnings/20/05/16085182/climate-change-up-and-down-pattern-continues-as-week-advances-and-powell-awaited,JJ Kinahan,2020-05-21 00:00:00,NVDA,1,2,1,0,0,0,1,1,1,0.4871
929082,credit suisse reinstates outperform on nvidia announces price target,https://www.benzinga.com/news/20/05/16083987/credit-suisse-reinstates-outperform-on-nvidia-announces-425-price-target,Vick Meyer,2020-05-21 00:00:00,NVDA,1,1,1,1,1,1,1,1,1,0.6909
929083,a peek into the markets us stock futures down ahead of earnings jobless claims data,https://www.benzinga.com/news/earnings/20/05/16082660/a-peek-into-the-markets-us-stock-futures-down-ahead-of-earnings-jobless-claims-data,Lisa Levin,2020-05-21 00:00:00,NVDA,1,1,1,1,1,0,1,1,1,0.5
929084, stocks to watch for may ,https://www.benzinga.com/news/earnings/20/05/16082493/8-stocks-to-watch-for-may-21-2020,Lisa Levin,2020-05-21 00:00:00,NVDA,1,2,1,1,1,0,1,1,1,0.5
929085,earnings scheduled for may ,https://www.benzinga.com/news/earnings/20/05/16082427/earnings-scheduled-for-may-21-2020,Lisa Levin,2020-05-21 00:00:00,NVDA,1,2,1,1,1,1,1,1,1,0.5
929086,chop chop strong earnings lift markets after tuesday thud fomc minutes ahead,https://www.benzinga.com/news/earnings/20/05/16077569/chop-chop-strong-earnings-lift-markets-after-tuesday-thud-fomc-minutes-ahead,JJ Kinahan,2020-05-20 00:00:00,NVDA,1,0,1,1,1,1,1,1,1,0.7553000000000001
929087,benzinga pros top stocks to watch for wednesday may baba spot nvda sgbx jd,https://www.benzinga.com/pre-market-outlook/20/05/16073789/benzinga-pros-top-5-stocks-to-watch-for-wednesday-may-20-2020-baba-spot-nvda-sgbx-jd,Benzinga Newsdesk,2020-05-20 00:00:00,NVDA,1,2,0,0,0,1,1,1,1,0.60115
929088,nvidia investors accuse chipmaker of misrepresenting b in crypto revenue in lawsuit,https://www.benzinga.com/markets/cryptocurrency/20/05/16064622/nvidia-investors-accuse-chipmaker-of-misrepresenting-1b-in-crypto-revenue-in-lawsuit,Shanthi Rexaline,2020-05-19 00:00:00,NVDA,1,1,0,0,0,0,1,1,1,0.29905000000000004
929089,stocks that hit week highs on tuesday,https://www.benzinga.com/news/20/05/16065784/stocks-that-hit-52-week-highs-on-tuesday,Benzinga Insights,2020-05-19 00:00:00,NVDA,1,2,0,0,1,1,1,1,1,0.5
929090,walmart earnings look strong across the board but home depot down after missing on eps,https://www.benzinga.com/markets/20/05/16065422/walmart-earnings-look-strong-across-the-board-but-home-depot-down-after-missing-on-eps,JJ Kinahan,2020-05-19 00:00:00,NVDA,1,1,1,1,1,1,1,1,1,0.41725
929091,nvidia shares are trading higher after susquehanna and rbc capital maintained their bullish ratings on the companys stock along with raising their price targets,https://www.benzinga.com/wiim/20/05/16065109/nvidia-shares-are-trading-higher-after-susquehanna-and-rbc-capital-maintained-their-bullish-ratings,Benzinga Newsdesk,2020-05-19 00:00:00,NVDA,1,0,1,1,1,1,1,1,1,0.648
929092,susquehanna maintains positive on nvidia raises price target to ,https://www.benzinga.com/news/20/05/16064971/susquehanna-maintains-positive-on-nvidia-raises-price-target-to-410,Vick Meyer,2020-05-19 00:00:00,NVDA,1,0,1,1,1,1,1,1,1,0.7787
929093,rbc capital maintains outperform on nvidia raises price target to ,https://www.benzinga.com/news/20/05/16064429/rbc-capital-maintains-outperform-on-nvidia-raises-price-target-to-385,vishwanath@benzinga.com,2020-05-19 00:00:00,NVDA,1,0,1,1,1,1,1,1,1,0.5
929094,bmo turns bullish on nvidia says its uniquely positioned for computing shift,https://www.benzinga.com/analyst-ratings/analyst-color/20/05/16056713/bmo-turns-bullish-on-nvidia-says-its-uniquely-positioned-for-computing-shift,Shanthi Rexaline,2020-05-18 00:00:00,NVDA,1,0,1,1,1,1,1,1,1,0.5
929095,walmart target and home depot among major retailers set to report earnings in days ahead,https://www.benzinga.com/news/earnings/20/05/16056192/walmart-target-home-depot-among-major-retailers-set-to-report-earnings-in-days-ahead,JJ Kinahan,2020-05-18 00:00:00,NVDA,1,2,1,1,1,0,1,1,1,0.5
929096,stocks that hit week highs on monday,https://www.benzinga.com/news/20/05/16056109/stocks-that-hit-52-week-highs-on-monday,Benzinga Insights,2020-05-18 00:00:00,NVDA,1,2,0,0,1,0,1,1,1,0.5
929097,benzingas top upgrades downgrades for may ,https://www.benzinga.com/markets/penny-stocks/20/05/16055291/benzingas-top-upgrades-downgrades-for-may-18-2020,Lisa Levin,2020-05-18 00:00:00,NVDA,1,1,1,1,1,1,1,1,1,0.60115
929098, biggest price target changes for monday,https://www.benzinga.com/analyst-ratings/price-target/20/05/16054282/10-biggest-price-target-changes-for-monday,Lisa Levin,2020-05-18 00:00:00,NVDA,1,2,0,0,0,0,1,0,1,0.5
929099,nvidia shares are trading higher after bmo capital upgraded the companys stock from market perform to outperform and raised its price target from to ,https://www.benzinga.com/wiim/20/05/16053611/nvidia-shares-are-trading-higher-after-bmo-capital-upgraded-the-companys-stock-from-market-perform-t,Benzinga Newsdesk,2020-05-18 00:00:00,NVDA,1,0,1,1,1,1,1,1,1,0.648
929100,bmo capital upgrades nvidia to outperform raises price target of ,https://www.benzinga.com/news/20/05/16053424/bmo-capital-upgrades-nvidia-to-outperform-raises-price-target-of-425,Vick Meyer,2020-05-18 00:00:00,NVDA,1,0,1,1,1,1,1,1,1,0.5
929101,nvidia analyst says new amperebased data center gpu makes chipmaker unassailable,https://www.benzinga.com/analyst-ratings/analyst-color/20/05/16043371/nvidia-analyst-says-new-ampere-based-data-center-gpu-makes-chipmaker-unassailable,Shanthi Rexaline,2020-05-15 00:00:00,NVDA,1,1,1,1,1,1,1,1,1,0.5
929102,quick retreat impressive thursday turnaround halted in its tracks amid fresh trade tiff,https://www.benzinga.com/news/20/05/16043881/quick-retreat-impressive-thursday-turnaround-halted-in-its-tracks-amid-fresh-trade-tiff,JJ Kinahan,2020-05-15 00:00:00,NVDA,1,1,1,1,0,0,1,1,1,0.8753
929103,raymond james reiterates outperform on nvidia raises price target to ,https://www.benzinga.com/news/20/05/16042257/raymond-james-reiterates-outperform-on-nvidia-raises-price-target-to-330,Benzinga_Newsdesk,2020-05-15 00:00:00,NVDA,1,1,1,1,1,1,1,1,1,0.5
929104,nvidia datasheet shows dgx a to use dual amd rome ,https://www.benzinga.com/tech/20/05/16034752/nvidia-datasheet-shows-dgx-a100-to-use-dual-amd-rome-7742,Benzinga Newsdesk,2020-05-14 00:00:00,NVDA,1,2,1,1,0,0,1,1,1,0.5
929105,nvidia ceo talks new amperebased gpu advanced ai system in gtc keynote,https://www.benzinga.com/news/20/05/16033361/nvidia-ceo-talks-new-ampere-based-gpu-advanced-ai-system-in-gtc-2020-keynote,Shanthi Rexaline,2020-05-14 00:00:00,NVDA,1,2,1,1,1,1,1,1,1,0.625
929106,nvidia highlights expansion of its clara healthcare platform with new capabilities partnerships to help medical community track test treat coronavirus,https://www.benzinga.com/news/20/05/16031658/nvidia-highlights-expansion-of-its-clara-healthcare-platform-with-new-capabilities-partnerships-to-h,Benzinga Newsdesk,2020-05-14 00:00:00,NVDA,1,0,1,1,1,1,1,1,1,0.82985
929107,another nvidia analyst boosts price target ahead of q report,https://www.benzinga.com/analyst-ratings/analyst-color/20/05/16022695/another-nvidia-analyst-boosts-price-target-ahead-of-q1-report,Shanthi Rexaline,2020-05-13 00:00:00,NVDA,1,0,1,1,1,1,1,1,1,0.6591
929108,wedbush maintains outperform on nvidia raises price target to ,https://www.benzinga.com/news/20/05/16022435/wedbush-maintains-outperform-on-nvidia-raises-price-target-to-340,Vick Meyer,2020-05-13 00:00:00,NVDA,1,0,1,1,1,1,1,1,1,0.5
929109,stay at home stocks still rule the roost as nvidia microsoft apple start week firmly,https://www.benzinga.com/news/earnings/20/05/16014775/stay-at-home-stocks-still-rule-the-roost-as-nvidia-microsoft-apple-start-week-firmly,JJ Kinahan,2020-05-12 00:00:00,NVDA,1,1,1,1,1,0,1,1,1,0.5
929110, options strategies for nvidia ahead of earnings,https://www.benzinga.com/news/earnings/20/05/16001901/2-options-strategies-for-nvidia-ahead-of-earnings,Spencer Israel,2020-05-12 00:00:00,NVDA,1,2,1,1,1,1,1,1,1,0.5
929111,stocks that hit week highs on tuesday,https://www.benzinga.com/news/20/05/16011435/stocks-that-hit-52-week-highs-on-tuesday,Benzinga Insights,2020-05-12 00:00:00,NVDA,1,2,0,0,1,1,1,1,1,0.5
929112,not just fun and games how esports could offer potential investment opportunities,https://www.benzinga.com/general/education/20/05/16008509/not-just-fun-and-games-how-esports-could-offer-potential-investment-opportunities,TD Ameritrade,2020-05-12 00:00:00,NVDA,1,2,1,1,1,1,1,1,1,0.48685
929113,why nvidia has a new streethigh price target,https://www.benzinga.com/analyst-ratings/analyst-color/20/05/16002288/why-nvidia-has-a-new-street-high-price-target,Shanthi Rexaline,2020-05-11 00:00:00,NVDA,1,2,1,1,1,1,1,1,1,0.5
929114,stocks that hit week highs on monday,https://www.benzinga.com/news/20/05/16000864/stocks-that-hit-52-week-highs-on-monday,Benzinga Insights,2020-05-11 00:00:00,NVDA,1,2,0,0,1,0,1,1,1,0.5
929115, biggest price target changes for monday,https://www.benzinga.com/analyst-ratings/price-target/20/05/15999027/10-biggest-price-target-changes-for-monday,Lisa Levin,2020-05-11 00:00:00,NVDA,1,2,0,0,0,0,1,0,1,0.5
929116,needham maintains buy on nvidia raises price target to ,https://www.benzinga.com/news/20/05/15998197/needham-maintains-buy-on-nvidia-raises-price-target-to-360,vishwanath@benzinga.com,2020-05-11 00:00:00,NVDA,1,0,1,1,1,1,1,1,1,0.5
929117,fast money picks for may ea nike nvidia,https://www.benzinga.com/media/20/05/15996545/fast-money-picks-for-may-11,Craig Jones,2020-05-10 00:00:00,NVDA,1,2,1,1,0,1,1,1,1,0.5
929118,shares of several technology companies are trading higher amid market strength after us job loss figures came in better than expected the sector has been strong recently as several companies reported strong earnings and benefited from online services,https://www.benzinga.com/wiim/20/05/15989692/shares-of-several-technology-companies-are-trading-higher-amid-market-strength-after-us-job-loss-fig,Benzinga Newsdesk,2020-05-08 00:00:00,NVDA,0,0,1,1,1,1,1,1,1,0.9559
929119,nvidia shares are trading higher after suntrust analysts maintained a buy rating on the stock and raised their price target from to the tech sector has been strong this week amid a rebound in economic sentiment,https://www.benzinga.com/wiim/20/05/15981273/nvidia-shares-are-trading-higher-after-suntrust-analysts-maintained-a-buy-rating-on-the-stock-and-ra,Benzinga Newsdesk,2020-05-07 00:00:00,NVDA,1,0,1,1,1,1,1,1,1,0.83525
929120,suntrust robinson humphrey maintains buy on nvidia raises price target to ,https://www.benzinga.com/news/20/05/15980296/suntrust-robinson-humphrey-maintains-buy-on-nvidia-raises-price-target-to-327,vishwanath@benzinga.com,2020-05-07 00:00:00,NVDA,1,0,1,1,1,1,1,1,1,0.5
929121,susquehanna maintains positive on nvidia raises price target to ,https://www.benzinga.com/news/20/05/15946308/susquehanna-maintains-positive-on-nvidia-raises-price-target-to-355,Vick Meyer,2020-05-04 00:00:00,NVDA,1,0,1,1,1,1,1,1,1,0.7787
929122,nvidia shares unaffected following report nvidia plans to buy cumulus networks in networking software play,https://www.benzinga.com/m-a/20/05/15945298/nvidia-shares-unaffected-following-report-nvidia-plans-to-buy-cumulus-networks-in-networking-softwar,Benzinga Newsdesk,2020-05-04 00:00:00,NVDA,1,2,1,1,1,1,1,1,1,0.7787
929123,shares of several technology companies are trading lower on market weakness as investor uncertainty grows following quarterly earnings results from multiple companies note this could potentially be a selloff after the sp rallied over the past month,https://www.benzinga.com/wiim/20/05/15933074/shares-of-several-technology-companies-are-trading-lower-on-market-weakness-as-investor-uncertainty,Benzinga Newsdesk,2020-05-01 00:00:00,NVDA,0,1,0,1,0,0,0,0,0,0.18155
929124,nvidia to report q earnings thurs may ,https://www.benzinga.com/news/earnings/20/04/15928057/nvidia-to-report-q1-earnings-thurs-may-21-2020,Benzinga Newsdesk,2020-04-30 00:00:00,NVDA,1,2,1,0,1,1,1,1,1,0.5
929125,shares of several technology companies are trading higher amid market strength following positive data from a study of gileads remdesivir which is being evaluated for coronavirus a successful treatment could mean a sooner return to economic activity note some names may also be moving in sympathy following recent earnings from google and some semiconductor companies,https://www.benzinga.com/wiim/20/04/15908706/shares-of-several-technology-companies-are-trading-higher-amid-market-strength-following-positive-da,Benzinga Newsdesk,2020-04-29 00:00:00,NVDA,1,0,1,1,1,1,1,1,1,0.968
929126,may market outlook no spring fling this year as dismal data weak earnings seen ahead,https://www.benzinga.com/news/earnings/20/04/15907226/may-market-outlook-no-spring-fling-this-year-as-dismal-data-weak-earnings-seen-ahead,JJ Kinahan,2020-04-29 00:00:00,NVDA,1,1,0,0,0,0,0,0,0,0.07790000000000002
929127,morgan stanley maintains overweight on nvidia raises price target to ,https://www.benzinga.com/news/20/04/15895417/morgan-stanley-maintains-overweight-on-nvidia-raises-price-target-to-282,Vick Meyer,2020-04-28 00:00:00,NVDA,1,1,1,1,1,1,1,1,1,0.3194
929128,ive been dreaming about this nvidia ceo says after b mellanox acquisition deal finally closed,https://www.benzinga.com/m-a/20/04/15891888/ive-been-dreaming-about-this-nvidia-ceo-says-after-7b-mellanox-acquisition-deal-finally-closed,Neer Varshney,2020-04-27 00:00:00,NVDA,1,2,1,1,1,1,1,1,1,0.5
929129,why nvidias stock is trading higher today,https://www.benzinga.com/news/20/04/15885611/why-nvidias-stock-is-trading-higher-today,Tanzeel Akhtar,2020-04-27 00:00:00,NVDA,1,0,1,1,1,1,1,1,1,0.5
929130,nvidia shares are trading higher potentially on overall market strength as some states announced their plans to reopen in phases the company also announced the completion of the acquisition of mellanox,https://www.benzinga.com/wiim/20/04/15884781/nvidia-shares-are-trading-potentially-on-overall-market-strength-as-some-states-announced-their-plan,Benzinga Newsdesk,2020-04-27 00:00:00,NVDA,1,0,1,1,1,0,1,1,1,0.82985
929131,a peek into the markets us stock futures signal higher start on wall street,https://www.benzinga.com/news/20/04/15882209/a-peek-into-the-markets-us-stock-futures-signal-higher-start-on-wall-street,Lisa Levin,2020-04-27 00:00:00,NVDA,1,0,1,1,1,1,1,1,1,0.5
