Unnamed: 0,headline,url,publisher,date,stock,Sentiment_DecisionTreeClassifier,Sentiment_finbert,Sentiment_LogisticRegression,Sentiment_KNeighborsClassifier,Sentiment_MultinomialNB,Sentiment_SGDClassifier,Sentiment_GradientBoostingClassifier,Sentiment_XGBClassifier,Sentiment_RandomForestClassifier,Sentiment_VADER
929728,samsung ceo sees intensified competition in chip market due to oversupply,https://www.benzinga.com/news/19/03/13391689/samsung-ceo-sees-intensified-competition-in-chip-market-due-to-oversupply,Charles Gross,2019-03-19 00:00:00,NVDA,1,1,0,0,0,0,1,1,1,0.5
929729, stocks moving in tuesdays midday session,https://www.benzinga.com/news/19/03/13388164/45-stocks-moving-in-tuesdays-mid-day-session,Lisa Levin,2019-03-19 00:00:00,NVDA,1,2,0,0,0,0,1,1,1,0.5
929730, stocks moving in tuesdays midday session,https://www.benzinga.com/news/19/03/13388052/45-stocks-moving-in-tuesdays-mid-day-session,Lisa Levin,2019-03-19 00:00:00,NVDA,1,2,0,0,0,0,1,1,1,0.5
929731,amd analyst says cloud gaming a good opportunity but stock is ahead of itself,https://www.benzinga.com/analyst-ratings/analyst-color/19/03/13386033/amd-analyst-says-cloud-gaming-a-good-opportunity-but-st,Shanthi Rexaline,2019-03-19 00:00:00,NVDA,1,1,1,1,1,1,1,1,1,0.7155
929732,on semiconductor collaborates with nvidia on cloudbased autonomous vehicle simulation,https://www.benzinga.com/tech/19/03/13387487/on-semiconductor-collaborates-with-nvidia-on-cloud-based-autonomous-vehicle-simu,Benzinga Newsdesk,2019-03-19 00:00:00,NVDA,1,2,1,1,1,1,1,1,1,0.5
929733,analysts dissect nvidias product announcements evolutionary rather than gamechanging,https://www.benzinga.com/analyst-ratings/analyst-color/19/03/13385418/analysts-dissect-nvidias-product-announcements-evolutio,Shanthi Rexaline,2019-03-19 00:00:00,NVDA,1,2,1,0,1,0,1,1,1,0.5
929734,nvidia shares are trading higher after the company teamed up with amazon web services iot to bring ai to millions of connected devices,https://www.benzinga.com/markets/wiim/19/03/13386543/nvidia-shares-are-trading-higher-after-the-company-teamed-up-with-amazon,Benzinga Newsdesk,2019-03-19 00:00:00,NVDA,1,0,1,0,1,1,1,1,1,0.7202
929735,nvidia teams with amazon web services to bring ai to millions of connected devices,https://www.benzinga.com/news/19/03/13383556/nvidia-teams-with-amazon-web-services-to-bring-ai-to-millions-of-connected-devic,Charles Gross,2019-03-19 00:00:00,NVDA,1,0,1,1,1,1,1,1,1,0.58895
929736,shares of several semiconductor companies are trading higher after broadcom reported betterthanexpected q eps and issued strong fy guidance,https://www.benzinga.com/markets/wiim/19/03/13368371/shares-of-several-semiconductor-companies-are-trading-higher-after-broad,Benzinga Newsdesk,2019-03-15 00:00:00,NVDA,1,0,1,1,1,1,1,1,1,0.83525
929737,pro nvidias stock at a tipping point,https://www.benzinga.com/analyst-ratings/analyst-color/19/03/13361371/pro-nvidias-stock-at-a-tipping-point,Jayson Derrick,2019-03-14 00:00:00,NVDA,1,0,1,1,1,1,1,1,1,0.5
929738,global barometer oracle earnings could provide insight on economy,https://www.benzinga.com/news/earnings/19/03/13360722/global-barometer-oracle-earnings-could-provide-insight-on-economy,JJ Kinahan,2019-03-14 00:00:00,NVDA,1,2,1,0,1,1,1,1,1,0.5
929739,china might take some starch out of us rally with more weak economic data,https://www.benzinga.com/news/earnings/19/03/13360307/china-might-take-some-starch-out-of-u-s-rally-with-more-weak-economic-d,JJ Kinahan,2019-03-14 00:00:00,NVDA,1,1,0,1,0,0,0,0,0,0.25365
929740,whats next for nvidia and mellanox,https://www.benzinga.com/analyst-ratings/analyst-color/19/03/13345756/whats-next-for-nvidia-and-mellanox,Jayson Derrick,2019-03-12 00:00:00,NVDA,1,2,1,1,0,1,1,1,1,0.5
929741,starboard value comments following news of nvidia offer to mellanox says has sold its entire position in mellanox,https://www.benzinga.com/news/19/03/13346886/starboard-value-comments-following-news-of-nvidia-offer-to-mellanox-says-has-sol,Benzinga Newsdesk,2019-03-12 00:00:00,NVDA,1,2,1,1,1,1,1,1,1,0.67
929742,brexit time again as parliament votes us stocks have mixed tone with boeing down,https://www.benzinga.com/news/earnings/19/03/13343571/brexit-time-again-as-parliament-votes-u-s-stocks-have-mixed-tone-with-b,JJ Kinahan,2019-03-12 00:00:00,NVDA,1,1,0,0,0,0,1,1,1,0.5
929743, biggest movers from yesterday,https://www.benzinga.com/news/19/03/13340970/50-biggest-movers-from-yesterday,Lisa Levin,2019-03-12 00:00:00,NVDA,1,2,1,1,1,1,1,1,1,0.5
929744,the early reaction to nvidias acquisition of mellanox,https://www.benzinga.com/analyst-ratings/analyst-color/19/03/13335715/the-early-reaction-to-nvidias-acquisition-of-mellanox,Jayson Derrick,2019-03-11 00:00:00,NVDA,1,2,1,1,1,1,1,1,1,0.5
929745,midafternoon market update crude oil up yatra online shares spike higher,https://www.benzinga.com/news/19/03/13337525/mid-afternoon-market-update-crude-oil-up-1-2-yatra-online-shares-spike-higher,Lisa Levin,2019-03-11 00:00:00,NVDA,1,0,1,1,1,1,1,1,1,0.3194
929746, stocks moving in mondays midday session,https://www.benzinga.com/news/19/03/13335538/40-stocks-moving-in-mondays-mid-day-session,Lisa Levin,2019-03-11 00:00:00,NVDA,1,2,0,0,0,0,1,1,1,0.5
929747,midday market update nasdaq rises over points axovant sciences shares surge,https://www.benzinga.com/news/19/03/13335526/mid-day-market-update-nasdaq-rises-over-100-points-axovant-sciences-shares-surge,Lisa Levin,2019-03-11 00:00:00,NVDA,1,0,1,1,0,0,1,0,1,0.648
929748,nvidia shares are trading higher after the company announced it will acquire mellanox technologies for billion,https://www.benzinga.com/markets/wiim/19/03/13335107/nvidia-shares-are-trading-higher-after-the-company-announced-it-will-acq,Benzinga Newsdesk,2019-03-11 00:00:00,NVDA,1,0,1,1,1,1,1,1,1,0.648
929749,midmorning market update markets mostly higher nvidia to buy mellanox technologies for b,https://www.benzinga.com/news/19/03/13334923/mid-morning-market-update-markets-mostly-higher-nvidia-to-buy-mellanox-technolog,Lisa Levin,2019-03-11 00:00:00,NVDA,1,2,1,1,1,1,1,1,1,0.5
929750,from nvidia call to discuss mellanox purchase cfo says mgmt to focus rest of calendar year to close deal notes approval in us china still needed,https://www.benzinga.com/news/19/03/13334148/from-nvidia-call-to-discuss-mellanox-purchase-cfo-says-mgmt-to-focus-rest-of-cal,Benzinga Newsdesk,2019-03-11 00:00:00,NVDA,1,2,1,1,1,1,1,1,1,0.7383500000000001
929751,nvidia to buy mellanox technologies for b,https://www.benzinga.com/news/19/03/13333915/nvidia-to-buy-mellanox-technologies-for-6-9b,Jayson Derrick,2019-03-11 00:00:00,NVDA,1,2,1,1,1,1,1,1,1,0.5
929752,a peek into the markets boeing leads dow futures lower,https://www.benzinga.com/news/19/03/13333477/a-peek-into-the-markets-boeing-leads-dow-futures-lower,Lisa Levin,2019-03-11 00:00:00,NVDA,0,2,0,1,0,0,0,0,0,0.352
929753,mellanox to be acquired by nvidia for share cash,https://www.benzinga.com/news/19/03/13333363/mellanox-to-be-acquired-by-nvidia-for-125share-cash,Benzinga Newsdesk,2019-03-11 00:00:00,NVDA,1,2,1,0,1,1,1,1,1,0.648
929754, stocks to watch for march ,https://www.benzinga.com/news/earnings/19/03/13332880/7-stocks-to-watch-for-march-11-2019,Lisa Levin,2019-03-11 00:00:00,NVDA,1,2,0,0,0,0,1,1,1,0.5
929755,nvidia near deal to acquire mellanox technologies for b in cash,https://www.benzinga.com/news/19/03/13332506/nvidia-near-deal-to-acquire-mellanox-technologies-for-7b-in-cash,Charles Gross,2019-03-10 00:00:00,NVDA,1,2,1,1,1,1,1,1,1,0.5
929756,do you love cult stocks,https://www.benzinga.com/markets/cryptocurrency/19/03/13283831/do-you-love-cult-stocks,Wayne Duggan,2019-03-08 00:00:00,NVDA,1,2,1,1,1,1,1,1,1,0.81845
929757,global semiconductor market dips for first time in months shrinking demand from data centers and china blamed for decline nikkei asian review,https://www.benzinga.com/news/19/03/13321031/global-semiconductor-market-dips-for-first-time-in-30-months-shrinking-demand-fr,Benzinga Newsdesk,2019-03-07 00:00:00,NVDA,1,1,1,1,1,1,1,1,1,0.2213
929758,semiconductor industry association reports decline in global chip sales in january,https://www.benzinga.com/news/19/03/13307287/semiconductor-industry-association-reports-7-2-decline-in-global-chip-sales-in-j,Charles Gross,2019-03-06 00:00:00,NVDA,1,1,1,0,1,1,1,1,1,0.5
929759,as trade optimism grows markets turn green and boeing caterpillar among leaders,https://www.benzinga.com/news/earnings/19/02/13236263/as-trade-optimism-grows-markets-turn-green-and-boeing-caterpillar-among,JJ Kinahan,2019-02-25 00:00:00,NVDA,1,0,1,1,1,1,1,1,1,0.77115
929760,barrons picks and pans apple altria micron technology nvidia and more,https://www.benzinga.com/media/19/02/13232574/barrons-picks-and-pans-apple-altria-micron-technology-nvidia-and-more,Nelson Hem,2019-02-23 00:00:00,NVDA,1,2,1,1,1,1,1,1,1,0.5
929761,why this analyst sees upside in nvidia,https://www.benzinga.com/analyst-ratings/analyst-color/19/02/13228305/why-this-analyst-sees-25-upside-in-nvidia,Jayson Derrick,2019-02-22 00:00:00,NVDA,1,2,1,1,1,1,1,1,1,0.5
929762,update atlantic equities initiates nvidia with overweight and a target as firm believes the headwinds are transitory and growth should reaccelerate given underlying fundamentals leaving the recent selloff creating an attractive entry point,https://www.benzinga.com/analyst-ratings/analyst-color/19/02/13229210/update-atlantic-equities-initiates-nvidia-with-overweig,Benzinga_Newsdesk,2019-02-22 00:00:00,NVDA,1,0,1,1,1,1,1,1,1,0.81845
929763,atlantic equities initiates coverage on nvidia with overweight rating announces price target,https://www.benzinga.com/news/19/02/13227909/atlantic-equities-initiates-coverage-on-nvidia-with-overweight-rating-announces-,Benzinga_Newsdesk,2019-02-22 00:00:00,NVDA,1,2,1,1,1,1,1,1,1,0.3194
929764,an electric outlook for the esports etf,https://www.benzinga.com/analyst-ratings/analyst-color/19/02/13196303/an-electric-outlook-for-the-esports-etf,ETF Professor,2019-02-19 00:00:00,NVDA,1,2,1,1,1,1,1,1,1,0.5
929765,nvidia shares up after earnings but a weak recovery does not bode well for the chart,https://www.benzinga.com/19/02/13190738/nvidia-shares-up-after-earnings-but-a-weak-recovery-does-not-bode-well-for-the-chart,Steve Miller,2019-02-15 00:00:00,NVDA,1,1,0,1,0,0,0,0,0,0.1663
929766, stocks moving in fridays midday session,https://www.benzinga.com/news/19/02/13189924/52-stocks-moving-in-fridays-mid-day-session,Lisa Levin,2019-02-15 00:00:00,NVDA,1,2,0,0,0,0,1,1,1,0.5
929767,benzinga pros top mostsearched tickers for afternoon of fri feb ,https://www.benzinga.com/news/19/02/13189921/benzinga-pros-top-10-most-searched-tickers-for-afternoon-of-fri-feb-15-2019,Benzinga Newsdesk,2019-02-15 00:00:00,NVDA,1,2,1,1,0,1,1,1,1,0.60115
929768,analysts nvidia needs a big second half of ,https://www.benzinga.com/analyst-ratings/analyst-color/19/02/13189415/analysts-nvidia-needs-a-big-second-half-of-2019,Wayne Duggan,2019-02-15 00:00:00,NVDA,1,2,0,1,0,0,1,1,1,0.5
929769,benzinga pros top mostsearched tickers for morning of fri feb ,https://www.benzinga.com/news/19/02/13188293/benzinga-pros-top-10-most-searched-tickers-for-morning-of-fri-feb-15-2019,Benzinga Newsdesk,2019-02-15 00:00:00,NVDA,1,2,1,0,1,1,1,1,1,0.60115
929770, stocks moving in fridays premarket session,https://www.benzinga.com/news/19/02/13187641/31-stocks-moving-in-fridays-pre-market-session,Lisa Levin,2019-02-15 00:00:00,NVDA,1,2,0,1,0,0,1,1,1,0.5
929771,nvidia shares are trading higher after the company said it expects revenue to be roughly the same as while analysts expected a revenue drop,https://www.benzinga.com/markets/wiim/19/02/13187568/nvidia-shares-are-trading-higher-after-the-company-said-it-expects-2020-,Benzinga 窶丑ewsdesk,2019-02-15 00:00:00,NVDA,1,0,1,1,1,0,1,1,0,0.5129
929772,a peek into the markets us stock futures edge higher ahead of economic reports,https://www.benzinga.com/news/19/02/13187126/a-peek-into-the-markets-us-stock-futures-edge-higher-ahead-of-economic-reports,Lisa Levin,2019-02-15 00:00:00,NVDA,1,0,1,1,1,1,1,1,1,0.5
929773,update loups munster sees nvidia shares being range bound in the coming months as investors will likely trim revenue expectations,https://www.benzinga.com/analyst-ratings/analyst-color/19/02/13186696/update-loups-munster-sees-nvidia-shares-being-range-bou,Benzinga Newsdesk,2019-02-15 00:00:00,NVDA,1,1,1,1,1,0,1,1,1,0.648
929774,loup ventures gene munster on nvidia results while we are believers in the nvidia storywe believe that there remains risk to fy guidance,https://www.benzinga.com/analyst-ratings/analyst-color/19/02/13186687/loup-ventures-gene-munster-on-nvidia-results-while-we-a,Benzinga Newsdesk,2019-02-15 00:00:00,NVDA,1,2,1,1,0,1,1,1,1,0.3634
929775, stocks to watch for february ,https://www.benzinga.com/news/earnings/19/02/13186340/10-stocks-to-watch-for-february-15-2019,Lisa Levin,2019-02-15 00:00:00,NVDA,1,2,1,1,1,1,1,1,1,0.5
929776, stocks moving in thursdays afterhours session,https://www.benzinga.com/news/19/02/13182618/7-stocks-moving-in-thursdays-after-hours-session,Brett Hershman,2019-02-14 00:00:00,NVDA,1,2,1,0,0,0,1,1,1,0.5
929777,nvidia shares spike higher following q earnings beat,https://www.benzinga.com/news/earnings/19/02/13181546/nvidia-shares-spike-higher-following-q4-earnings-beat,Brett Hershman,2019-02-14 00:00:00,NVDA,1,0,1,1,1,1,1,1,1,0.648
929778,nvidia q eps vs reuters estimate sales b beat b reuters estimate,https://www.benzinga.com/news/earnings/19/02/13181393/nvidia-q4-eps-0-80-vs-0-75-reuters-estimate-sales-2-21b-miss-2-2b-reute,Benzinga Newsdesk,2019-02-14 00:00:00,NVDA,1,2,0,0,0,0,1,1,1,0.5
929779,oppenheimer on feb previewed nvidia earnings said sees negative bias to street q saleseps noted q guidance cut stemmed from lingering pascalcrypto drag though most of the incremental weakness came from dc and highend turing gpu demand,https://www.benzinga.com/analyst-ratings/analyst-color/19/02/13180744/oppenheimer-on-feb-11-previewed-nvidia-earnings-said-se,Benzinga Newsdesk,2019-02-14 00:00:00,NVDA,0,1,0,0,0,0,0,0,0,0.056999999999999995
929780,nvidia to report q earnings after the closing bell co historically issues its report at pm et things to watch include gaming and datacenter revenue for which the company previously guidance,https://www.benzinga.com/news/earnings/19/02/13180360/nvidia-to-report-q4-earnings-after-the-closing-bell-co-historically-iss,Benzinga Newsdesk,2019-02-14 00:00:00,NVDA,1,2,1,1,0,0,1,1,1,0.5
929781, stocks to watch for february ,https://www.benzinga.com/news/earnings/19/02/13170248/11-stocks-to-watch-for-february-14-2019,Lisa Levin,2019-02-14 00:00:00,NVDA,1,2,1,1,1,1,1,1,1,0.5
929782,earnings scheduled for february ,https://www.benzinga.com/news/earnings/19/02/13170209/earnings-scheduled-for-february-14-2019,Lisa Levin,2019-02-14 00:00:00,NVDA,1,2,1,1,1,1,1,1,1,0.5
929783,bernstein downgrades hamstrung nvidia,https://www.benzinga.com/analyst-ratings/analyst-color/19/02/13138154/bernstein-downgrades-hamstrung-nvidia,Wayne Duggan,2019-02-11 00:00:00,NVDA,1,1,1,1,0,1,1,1,1,0.5
929784,benzinga pros top mostsearched tickers for morning of monday february ,https://www.benzinga.com/news/19/02/13138250/benzinga-pros-top-10-most-searched-tickers-for-morning-of-monday-february-11-201,luke@benzinga.com,2019-02-11 00:00:00,NVDA,1,2,1,0,1,1,1,1,1,0.60115
929785, biggest price target changes for monday,https://www.benzinga.com/analyst-ratings/price-target/19/02/13138182/10-biggest-price-target-changes-for-monday,Lisa Levin,2019-02-11 00:00:00,NVDA,1,2,0,0,0,0,1,0,1,0.5
929786,benzingas top upgrades downgrades for february ,https://www.benzinga.com/analyst-ratings/upgrades/19/02/13137820/benzingas-top-upgrades-downgrades-for-february-11-2019,Lisa Levin,2019-02-11 00:00:00,NVDA,1,1,1,1,1,1,1,1,1,0.60115
929787,nvidia shares are trading lower after bernstein downgraded the stock from outperform to market preform and lowered the price target from to ,https://www.benzinga.com/markets/wiim/19/02/13137348/nvidia-shares-are-trading-lower-after-bernstein-downgraded-the-stock-fro,Benzinga 窶丑ewsdesk,2019-02-11 00:00:00,NVDA,0,1,0,1,0,0,0,0,0,0.436
929788,update bernstein downgrades nvidia as firm notes the latest cut appears much more fundamentally demanddriven with the question of the true runrate of the gaming business remaining up in the air for now,https://www.benzinga.com/analyst-ratings/analyst-color/19/02/13137026/update-bernstein-downgrades-nvidia-as-firm-notes-the-la,Benzinga_Newsdesk,2019-02-11 00:00:00,NVDA,0,1,0,0,1,0,0,1,0,0.58895
929789,bernstein downgrades nvidia to market perform lowers price target to ,https://www.benzinga.com/news/19/02/13136464/bernstein-downgrades-nvidia-to-market-perform-lowers-price-target-to-175,Benzinga_Newsdesk,2019-02-11 00:00:00,NVDA,1,1,0,1,0,0,1,1,1,0.436
929790,hearing calpers reduced holdings in apple amazon microsoft exxon mobil jp morgan facebook and nvidia in q,https://www.benzinga.com/general/hedge-funds/19/02/13132111/hearing-calpers-reduced-holdings-in-apple-amazon-microsoft-exxon-,Benzinga Newsdesk,2019-02-08 00:00:00,NVDA,1,1,1,0,0,1,1,1,1,0.6806
929791,weak eurozone forecast add to concerns about global growth,https://www.benzinga.com/news/earnings/19/02/13121403/weak-eurozone-forecast-add-to-concerns-about-global-growth,JJ Kinahan,2019-02-07 00:00:00,NVDA,1,1,1,1,1,1,0,0,0,0.4614
929792,shares of several semiconductors are trading lower after nxp semiconductors provided weak q sales guidance,https://www.benzinga.com/markets/wiim/19/02/13120982/shares-of-several-semiconductors-are-trading-lower-after-nxp-semiconduct,Benzinga Newsdesk,2019-02-07 00:00:00,NVDA,0,1,0,0,0,0,0,0,0,0.2798
929793,semiconductor and microchip stocks are trading higher after microchip technology reported strong earnings and skyworks reported a billion buyback,https://www.benzinga.com/markets/wiim/19/02/13110847/semiconductor-and-microchip-stocks-are-trading-higher-after-microchip-te,Benzinga Newsdesk,2019-02-06 00:00:00,NVDA,1,0,1,1,1,1,1,1,1,0.7553000000000001
929794,amd falls as major shareholder sells,https://www.benzinga.com/news/19/02/13099786/amd-falls-as-major-shareholder-sells,Elizabeth Balboa,2019-02-05 00:00:00,NVDA,1,2,0,0,0,0,1,0,0,0.5
929795,cypress semiconductor corp shares are trading higher after the company beat q earnings estimates shares of other semiconductor stocks are trading slightly higher in sympathy,https://www.benzinga.com/19/01/13079568/cypress-semiconductor-corp-shares-are-trading-higher-after-the-company-beat-q4-earnin,Benzinga Newsdesk,2019-01-31 00:00:00,NVDA,1,0,1,1,1,1,1,1,1,0.8422499999999999
929796,earnings volatility brexit are key topics heading into february,https://www.benzinga.com/government/19/01/13077426/earnings-volatility-brexit-are-key-topics-heading-into-february,JJ Kinahan,2019-01-31 00:00:00,NVDA,1,2,0,1,0,0,1,1,1,0.5
929797,nvidia option alert fri calls sweep near the ask vs oi earnings after close est ref,https://www.benzinga.com/markets/options/19/01/13067714/nvidia-option-alert-fri-136-calls-sweep-2-near-the-ask-500-2-9-vs-135,Charles Gross,2019-01-30 00:00:00,NVDA,1,0,1,1,1,1,1,1,1,0.648
929798,analysts weigh in on amd earnings relief rally,https://www.benzinga.com/analyst-ratings/analyst-color/19/01/13065683/analysts-weigh-in-on-amd-earnings-relief-rally,Wayne Duggan,2019-01-30 00:00:00,NVDA,1,1,1,1,0,0,1,1,1,0.7383500000000001
929799,chip and semiconductor stocks are trading higher following apple and amd earnings apple beat q estimates and amd reported q margin improvement,https://www.benzinga.com/markets/wiim/19/01/13066694/chip-and-semiconductor-stocks-are-trading-higher-following-apple-and-amd,Benzinga Newsdesk,2019-01-30 00:00:00,NVDA,1,0,1,1,1,1,1,1,1,0.7294
929800,analysts react to nvidias guidance cut,https://www.benzinga.com/analyst-ratings/analyst-color/19/01/13057159/analysts-react-to-nvidias-guidance-cut,Wayne Duggan,2019-01-29 00:00:00,NVDA,0,2,0,1,0,0,0,0,0,0.3634
929801,apple today powell tomorrow busy earnings and fed week continues,https://www.benzinga.com/news/earnings/19/01/13057537/apple-today-powell-tomorrow-busy-earnings-and-fed-week-continues,JJ Kinahan,2019-01-29 00:00:00,NVDA,1,2,1,1,1,1,1,1,1,0.5
929802,top price prediction bitcoin ripple ethereum suffers amid nvidia and quadrigacx as technical levels weigh,https://www.benzinga.com/markets/cryptocurrency/19/01/13056853/top-3-price-prediction-bitcoin-ripple-ethereum-suffers-amid-nv,Yohay Elam,2019-01-29 00:00:00,NVDA,1,1,0,1,0,0,1,1,1,0.3409
929803,nvidia shares are trading lower on continued weakness multiple analyst have downgraded the stock and cut price targets following the companys guidance cut,https://www.benzinga.com/markets/wiim/19/01/13056777/nvidia-shares-are-trading-lower-on-continued-weakness-multiple-analyst-h,Benzinga Newsdesk,2019-01-29 00:00:00,NVDA,0,1,0,0,0,0,0,0,0,0.14079999999999998
929804,ubs turns bullish on nvidia after guidance cut sees buying opportunity,https://www.benzinga.com/analyst-ratings/analyst-color/19/01/13055615/ubs-turns-bullish-on-nvidia-after-guidance-cut-sees-buy,Shanthi Rexaline,2019-01-29 00:00:00,NVDA,0,0,1,1,1,1,0,1,0,0.58895
929805, biggest price target changes for tuesday,https://www.benzinga.com/analyst-ratings/price-target/19/01/13055707/8-biggest-price-target-changes-for-tuesday,Lisa Levin,2019-01-29 00:00:00,NVDA,1,2,0,1,0,0,1,0,1,0.5
929806,morgan stanley downgrades nvidia faces more significant challenges than expected,https://www.benzinga.com/analyst-ratings/analyst-color/19/01/13055453/morgan-stanley-downgrades-nvidia-faces-more-significant,Jayson Derrick,2019-01-29 00:00:00,NVDA,1,1,0,1,0,0,1,1,0,0.6980999999999999
929807,benzinga pros top mostsearched tickers for morning of tues jan ,https://www.benzinga.com/news/19/01/13055458/benzinga-pros-top-10-most-searched-tickers-for-morning-of-tues-jan-29-2019,Benzinga Newsdesk,2019-01-29 00:00:00,NVDA,1,2,1,0,1,1,1,1,1,0.60115
929808,update needham downgrades nvidia and removes price target as firm believes end demand will deteriorate further in its core markets gaming of sales and datacenter driven by an ongoing deceleration in the chinese economy,https://www.benzinga.com/analyst-ratings/analyst-color/19/01/13055366/update-needham-downgrades-nvidia-and-removes-225-price-,Benzinga_Newsdesk,2019-01-29 00:00:00,NVDA,1,1,1,1,1,0,1,1,1,0.436
929809,benzingas top upgrades downgrades for january ,https://www.benzinga.com/analyst-ratings/upgrades/19/01/13055344/benzingas-top-upgrades-downgrades-for-january-29-2019,Lisa Levin,2019-01-29 00:00:00,NVDA,1,1,1,1,1,1,1,1,1,0.60115
929810,update morgan stanley downgrades nvidia as firm notes missing the quarter this badly in gaming indicates more significant challenges than we had anticipated given that this is still a channel fill quarter for midrangehigh end,https://www.benzinga.com/analyst-ratings/analyst-color/19/01/13055322/update-morgan-stanley-downgrades-nvidia-as-firm-notes-m,Benzinga_Newsdesk,2019-01-29 00:00:00,NVDA,1,1,1,1,0,0,1,1,1,0.257
929811,update ubs upgrades nvidia as firm notes important qs remain unanswered but we believe the miss to fq jan revenue and stock move finally sets the stage for a new positive revision cycle starting this summer,https://www.benzinga.com/analyst-ratings/analyst-color/19/01/13054833/update-ubs-upgrades-nvidia-as-firm-notes-important-qs-r,Benzinga_Newsdesk,2019-01-29 00:00:00,NVDA,1,0,1,1,1,1,1,1,1,0.82985
929812,needham downgrades nvidia to underperform,https://www.benzinga.com/news/19/01/13053946/needham-downgrades-nvidia-to-underperform,Benzinga_Newsdesk,2019-01-29 00:00:00,NVDA,1,1,1,1,0,1,1,1,1,0.5
929813,morgan stanley downgrades nvidia to equalweight lowers price target to ,https://www.benzinga.com/news/19/01/13053833/morgan-stanley-downgrades-nvidia-to-equal-weight-lowers-price-target-to-148,Vick Meyer,2019-01-29 00:00:00,NVDA,1,1,0,1,0,0,1,1,1,0.436
929814,ubs upgrades nvidia to buy lowers price target to ,https://www.benzinga.com/news/19/01/13053598/ubs-upgrades-nvidia-to-buy-lowers-price-target-to-180,Vick Meyer,2019-01-29 00:00:00,NVDA,1,0,1,1,1,1,1,1,1,0.436
929815, biggest movers from yesterday,https://www.benzinga.com/news/19/01/13052971/50-biggest-movers-from-yesterday,Lisa Levin,2019-01-29 00:00:00,NVDA,1,2,1,1,1,1,1,1,1,0.5
929816,morgan stanley downgrades nvidia to equalweight from overweigth lowers prices target to from ,https://www.benzinga.com/analyst-ratings/downgrades/19/01/13052963/morgan-stanley-downgrades-nvidia-to-equal-weight-from-over,Charles Gross,2019-01-29 00:00:00,NVDA,1,1,0,1,0,0,1,1,1,0.436
929817, stocks moving in mondays midday session,https://www.benzinga.com/news/19/01/13048677/36-stocks-moving-in-mondays-mid-day-session,Lisa Levin,2019-01-28 00:00:00,NVDA,1,2,0,0,0,0,1,1,1,0.5
929818,midmorning market update markets open lower caterpillar profit misses expectations,https://www.benzinga.com/news/19/01/13047264/mid-morning-market-update-markets-open-lower-caterpillar-profit-misses-expectati,Lisa Levin,2019-01-28 00:00:00,NVDA,0,1,0,1,0,0,0,0,0,0.4742
929819,nvidia cuts q sales guidance chips stocks tumble,https://www.benzinga.com/analyst-ratings/analyst-color/19/01/13046897/nvidia-cuts-q4-sales-guidance-chips-stocks-tumble,Jayson Derrick,2019-01-28 00:00:00,NVDA,1,1,0,1,0,0,1,0,1,0.352
929820,shares of nvidia are trading lower after the company cut q guidance citing weaker sales in its gaming and datacenter platforms,https://www.benzinga.com/markets/wiim/19/01/13046612/shares-of-nvidia-are-trading-lower-after-the-company-cut-q4-guidance-cit,Benzinga Newsdesk,2019-01-28 00:00:00,NVDA,0,1,0,0,0,0,0,0,0,0.19379999999999997
929821,vaneck vectors semiconductor etf down following q sales gross margin guidance cut from nvidia,https://www.benzinga.com/trading-ideas/movers/19/01/13046589/vaneck-vectors-semiconductor-etf-down-2-4-following-q4-sales-gro,Benzinga Newsdesk,2019-01-28 00:00:00,NVDA,0,1,0,0,0,0,0,0,0,0.18155
